,0
365,intern inc make purchs wavehil intern ventur inc said complet previouslyannounc acquisit person comput rental corp restrict common share give former sharehold person comput pct interest combin compani
366,hanson buy intl protein stock intern protein corp said agre sell privat placement common share dlr share u subsidiari hanson trust plc addit david clark presid anoth hanson trust subsidiari hanson industri name chairman intern protein execut committe upon elect board annual meet intern protein recent acquir clark famili busi great south beach sale co restrict common share issu date intern protein said agreement hanson trust subject stockhold approv annual meet expect held june compani said hanson trust purchas stock invest purpos ad agreement includ restrict purchas sale compani hanson next five year intern protein said use proce expand domest oper compani mln share outstand
367,ecuador trade surplu first four month ecuador post trade surplu mln dlr first four month compar surplu mln period central bank ecuador said latest monthli report ecuador suspend sale crude oil princip export product march earthquak destroy part oilproduc infrastructur export first four month around mln dlr import mln compar mln mln respect period last year export crude product first four month around mln dlr compar mln period central bank said januari may ecuador sold mln barrel crude mln barrel product compar mln mln respect period last year ecuador intern reserv end may around mln dlr compar mln end april mln end may central bank said gold reserv mln dlr end may compar mln end april
368,american softwar inc rd qtr jan net shr ct v ct net v rev mln v avg shr v nine mth shr ct v ct net v rev mln v mln avg shr v
369,babcock intern plc year div p make increas pct shr p v p adjust pretax profit mln stg v mln net mln v mln interest payabl mln v mln share associ co mln v mln turnov billion stg v billion
370,treasuri balanc fed fell march treasuri balanc feder reserv fell march billion dlr billion dlr previou busi day treasuri said latest budget statement balanc tax loan note account fell billion dlr billion dlr respect day treasuri oper cash balanc total billion dlr march compar billion dlr march
371,henley group set fisher distribut henley group inc said declar special dividend distribut one fisher scientif group inc share everi henley share previous said would pay one fisher share everi outstand chang ratio reduct outstand share mln mln said distribut pct fisher common stock made april six holder record march fisher trade nasdaq symbol
372,saatchi saatchi buy cleveland consult advertis agent saatchi saatchi co plc said buy consult associ inc initi consider mln dlr addit payment may made annual year end march bring total consider pct cleveland averag posttax profit last two year period purchas cleveland step saatchi saatchi fast grow consult industri compani said said consult oper provid platform major futur expans month end march cleveland dlr pretax profit forecast one mln saatchi saatchi annual meet today compani report particularli strong start current year profit sharpli higher period last year saatchi saatchi share rose one penni cleveland announc p yesterday p close
373,standard product co st qtr sept net shr ct v ct net v sale mln v mln avg shr mln v mln note share adjust august fiveforfour split
374,indonesia oil contract negoti end month negoti indonesia state oil compani pertamina foreign oil contractor extens standard year product share contract conclud end month pertamina offici said jumardi jukardi head pertamina foreign contractor coordin board gave detail outcom talk pertamina presid abdul rachman ramli said prioriti given extend contract compani whose explor product contract expir within next seven year jukardi speak indonesian report said negoti would determin whether product share split favour pertamina would adher alter case oil compani ask hardjoko seputro spokesman mine energi ministri said presid suharto agre principl extens standard year product share contract reflect better current depress condit intern oil market
375,uk money market given mln stg earli help bank england said provid money market earli assist mln stg respons earli round bill offer discount hous compar bank estim system would face shortag around billion stg today central bank made outright purchas bank bill compris mln stg band one pct mln stg band two pct mln stg band three pct
376,kuwait say full gulf arab support kuwait whose ship come repeat attack iran full support saudi arabia gulf alli senior govern offici said cabinet spokesman abdulaziz alotaibi quot kuwaiti news agenc kuna yesterday said foreign minist sheikh sabah alahm alsabah told cabinet found complet supportat delic phase visit gulf cooper council gcc state gcc econom militari allianc gener support iraq iran compris bahrain kuwait oman qatar saudi arabia unit arab emir
377,rio de janeiro ibc estim coffe crop mln bag rio de janeiro ibc estim coffe crop mln bag
378,japan march wholesal price rise pct pct februari drop offici japan march wholesal price rise pct pct februari drop offici
379,investor lift myer stake pct leonard chavin chicago real estat develop said consid seek control le myer co group said rais stake compani share pct pct file secur exchang commiss chavin said bought myer common share march price rang six dlr share last januari chavin said retain invest banker rg dickinson co advis myer stock deal also said would unabl seek control myer unless get financ
380,interst secur inc th qtr sept shr ct v ct qtli div ct v ct prior net v rev mln v mln year shr ct v dlr net v rev mln v mln note qtli div payabl decemb sharehold record novemb
381,walgreen co nd qtr feb net shr ct v ct qtli div ct v ct prior net mln v mln rev billion v one billion six mth shr ct v ct net mln v mln rev billion v billion note result includ charg four ct shr latest six mth v credit five ct shr prior six mth invest tax credit dividend payabl june record may
382,mercuri entertain corp year nov shr loss four ct v loss one ct net loss v loss rev v
383,world supplydemand estim issu usda u agricultur depart made follow project world supplydemand report comparison mln tonn except note total world grain produc total suppli tradex usag end stk xbase export estim wheat start stk product import feed use total dome export end stock note world importsexport may balanc due differ market year grain transit report discrep coars grain start stck product import feed use total dome export end stock note world importsexport may balanc due differ market year grain transit report discrep corn mln tonn start stck product import feed use ttl dome export end stock note world importsexport may balanc due differ market year grain transit report discrep soybean start stck product import crush ttl dome export end stock note import export balanc due differ market year time lag report export import soybean meal start stock product import consumpt export end stock note import export may balanc due differ market year time lag report export import soybean oil start stock product import consumpt export end stock note import export balanc due differ market year time lag report export import cotton mln bale start stck product import mill use export end stock note import export may balanc due cotton transit report discrep countri rice mill basi start stock product import dom use export end stock
384,madagascar rice crop estim higher madagascar vital rice crop estim tonn paddi year ministri agricultur said trade ministri said rice import quadrupl local currenc valu first nine month last year govern establish buffer stock countri stapl food rice import increas billion malagasi franc first nine month last year billion period ministri said without disclos tonnag involv
385,broadcast inc six mth feb net shr ct v ct net v rev mln v mln
386,u studi discu drop comsatcontel merger congression studi today said propos appar abandon merger commun satellit corp contel corp would technic legal could violat spirt law set comsat two week ago studi complet contel announc would seek termin propos merger studi non partisan congression research servic cr said propos merger appear compli technic mandat letter statut may nevertheless violat spirit law comsat creat act congress contel corpor local telephon commun firm file feder commun commiss last novemb applic merger sever firm protest propos merger analysi law research servic issu sever critic comment structur new firm said appar domin contel restructur comsat would broken spirit law set comsatcomsat u arm intelstat intern satellit commun firm reuterm
387,loctit see better expect net loctit corp said expect third quarter earn higher secur analyst forecast ct share last year compani earn ct per share third quarter attribut better expect forecast sale growth said particularli strong oversea also said lower effect tax rate
388,home feder save bank georgia rd qtr net shr ct v ct net v nine mth shr ct v dlr net v
389,nation averag price farmerown reserv u agricultur depart report farmerown reserv nation fiveday averag price februari follow dlrsbusorghum cwt natl loan releas call avg ratex level price price wheat iv v vi corn iv v x rate natl loan releas call avg ratex level price price oat v barley na iv v sorghum iv v reserv ii iii matur level iv reflect grain enter oct feedgrain juli wheat level v wheatbarley cornsorghum level vi cover wheat enter januari x rate ydlr per cwt lb nanot avail
390,ecuador cepe name new head staterun ecuadorean state oil corpor cepe name jaim sanchez valdivieso new gener manag replac carlo romo leroux cepe spokesman said spokesman told reuter sanchez yearold civil engin formerli head cepe administr financ divis romo leroux resign last week person famili reason spokesman said
391,transtech industri inc year net oper shr ct v seven ct oper net v rev mln v mln avg shr v note net exclud dlr loss discontinu oper
392,excel industri inc boost dividend qtli div nine ct v eight ct prior qtr pay april record april
393,itali worri rise tension gulf attack italian prime minist giovanni goria told cabinet monday worri increas tension gulf said america retali iran limit statement issu cabinet meet said goria inform unit state would take action iranian target gulf known beforehand action would involv attack oil platform prime minist express concern possibl consequ increas tension gulf time recogn limit charact american militari reaction attack suffer past day statement said goria said itali ship far platform time attack fleet advis follow event caution itali sent eight ship includ three frigat three minesweep gulf protect italian merchant ship
394,porsch expect improv u sale sport carmak dr ing hcf porsch ag said expect post satisfactori profit domest volum sale seen lower u sale anticip higher manag board chairman peter schutz said domest sale expect fall year end juli u sale rise last year schutz made specif profit sale forecast last month compani said expect net profit fall mln mark year mln mark sale porsch expect overal world volum year sale last year stood schutz said expect satisfactori profit base combin price rise costcut ad expect drop west german sale year would result socal grey market porsch car said dollar strong mark mani porsch bought local west germani illeg export u porsch previous said domest sale first half fell period fact u sale account larger percentag overal sale year pose problem profit porsch board said last month rais u price around pct without suffer declin sale time porsch hedg dollardenomin busi busi year financ director heinz branitzki branitzki put porsch hedg cost mln mark speech annual meet schutz said thirdparti order place porsch engin research centr weissach rise top mln mark year first time porsch net profit drop sharpli mln mark mln mark
395,stora close complet papyru takeov sweden stora kopparberg bergslag ab said acquir pct share rival pulp paper maker papyru ab thu pass threshold compulsorili buy rest compani remain sharehold would later month sell share stora compani said statement stora announc last septemb would acquir papyru price billion crown thu form europ second largest forest group londonbas reed intern plc l
396,fed johnson say louvr accord still vital feder reserv board vice chairman manuel johnson said louvr accord still healthi said unit state west germani must work differ respect role fulfil accord louvr accord work well term stabil exchang rate said respons question american stock exchang confer said exchang rate stabl far result accord
397,jp morgan increas prime rate jp morgan co inc said rais prime lend rate pct pct effect today major u bank post pct rate citibank first announc increas tuesday
398,canada januari retail sale fall pct decemb pct gain offici canada januari retail sale fall pct decemb pct gain offici
399,taiwan buy tonn u soybean joint committe taiwan soybean import award contract cigra inc chicago suppli tonn cargo u soybean committe spokesman told reuter cargo price u dlr per tonn c f taiwan deliveri april may
400,talk pointoil servic turnaround seen oil servic industri verg recoveri rise crude price oil industri analyst said analyst issu buy recommend stock said recoveri oil servic begin second half drill activ bottom first half continu next decad peopl howev cannot afford wait drill go start buy said sandi haber sweeney senior research analyst sanford c bernstein co inc among recommend buy schlumberg ltd halliburton co dresser industri baker intern mcdermott intern inc may target takeov harold simmon dallasbas investor analyst said although major oil compani increas explor develop oversea expect pickup oil servic begin u activ u depress move faster said vishnu sharp goldman sach number activ oil drill rig u last week compar rig one year ago huge tool co figur show averag number work rig u project versu accord ike kerridg vice presid stockhold relat hugh tool first signific pickup drill activ occur second half kerridg said oversea drill activ expect follow similar pattern kerridg said halliburton best valu said jeffrey freedman vice presid smith barney harri upham inc ad compani control greatest amount liquid common stock market valu diversif nonoil field businesess lowest multipl stock price oper cash flow includ debt schlumberg freedman second favorit oil servic stock schlumberg expect continu domin technic leader industri freedman said schlumberg manag shift asset restructur includ pend merger fairchild semiconductor consider cash hord set stage compani maxim signific industri advantag capit project upturn explor develop activ accord report georg gaspar first vice presid robert w baird co inc gaspar estim earn per share schlumberg ct one dlr compar ct exclud fourth quarter special charg billion dlr bernstein sandi sweeney recommend group oil servic compani said choos among difficult favorit baker intern involv possibl merger hugh tool co dresser industri also benefit recoveri possibl much compani pure servic compani sweeney said dresser expect improv profit owe cost reduct streamlin oper includ sale leaseback headquart said swarup
401,uk money market get billion stg earli help bank england said provid money market billion mln stg assist respons earli round bill offer discount hous earlier bank forecast system would face larg deficit today around billion stg central bank purchas bank bill outright compris mln stg band one pct mln stg band two pct mln stg band three pct addit bought mln stg local author bill band two pct
402,analyst say uk budget point base rate cut chancellor exchequ nigel lawson budget speech describ sound well balanc analyst slightli lack excit cut bank base lend rate wide expect tomorrow forecast predict halfpoint fall followup halfpoint cut anticip next week worthi bore would probabl sum peter fellner uk economist stockbrok jame capel co said prudent fiscal budget richard jeffrey broker hoar govett said wellbalanc budget within confin govern philosophi keep expenditur level flat analyst said budget sound fiscal side offer noth new monetari polici wide expect lawson split fiscal adjust trim psbr target billion stg billion cut basic rate incom tax pct target narrow measur money suppli kept unchangd two six pct target broad sterl aggreg drop jeffrey fellner said budget clear way halfpoint fall uk base rate tomorrow author unlik sanction larger cut immedi mani analyst currenc dealer forecast full onepoint cut tomorrow bank england loath take action revers later jeffrey said though ad halfpoint cut quit possibl near futur main worri today speech outlook inflat given sign relax monetari polici contain scrimgeour vicker economist richard holt said holt note rather loos inflat forecast pct end said lower interest rate like result tough fiscal stanc could caus longer term concern higher psbr target could prefer long term said although lower mortgag interest rate back fall base rate would offset impact inflat budget inspir lot shortterm confid good budget inflat said jeffrey said would like lawson say danger excess liquid buildup overal concern reviv inflat fellner note exchang rate remain lead edg monetari polici said author like extrem cautiou front said unlik hesit hold interest rate steadi even rais sterl show sign excess weak analyst agre lawson bolster credibl budget adopt realist forecast rais forecast current account deficit billion stg would unsettl market alreadi discount amount jeffrey said billion stg psbr target given credibl favour outturn also forecast billion stg analyst said budget speech give clearcut indic time gener elect held june believ signal poll june note benefit incom tax cut decis rais duti alcohol tobacco becom avail immedi other said kept sever option open possibl deduc much jame capel fellner note fiscal prudent lawson kept open possibl autumn elect would chicken come home roost richard jeffrey favour likelihood june elect said import chancellor gone budget aim overtli buy elect victori nevertheless said like result boost conserv parti preelect popular
403,advanc institut cut workforc advanc institut manag softwar inc said cut workforc close atlanta offic cut expens improv profit compani said also process reduc offic space four six offic nationwid advanc also said name execut vice presid steven b sheppard chief oper offic compani said presid chief execut offic morri moliv chief oper offic well
404,instrumentarium acquir nokia subsidiari finland medic group instrumentarium oy said acquir electron compon import market oy oy subsidiari finland electron group nokia oy said statement ferrado insel merg instrumentarium profession electron inform system divis disclos price acquisit said issu restrict b share partial payment nokia
405,paint compani metex stake may buy metropolitan consolid industri inc new york paint compani said acquir share metex corp pct total left open possibl might acquir merger file secur exchang commiss metropolitan said bought metex stock invest also said may buy addit share sell current stake buy share metropolitan said would consid open market privat deal exchang offer tender offer merger metropolitan said may acquir option may buy metex share own william hack metex director togeth wife hold compani common share pct total metropolitan said alreadi option buy anoth metex common share dlr option exercis april said metropolitan exercis option acquir hack stake would metex common share pct total metropolitan sec file made sharehold group hack metropolitan said spent mln dlr acquir metex stake list recent stock purchas common share march dlr share march dlr
406,iran say u naval forc attack two platform iran said u naval forc attack two oil platform southern gulf monday afternoon iranian news agenc irna report irna receiv nicosia said inform sourc iranian oil ministri identifi two platform resalat reshadat mile iran lavan island oil storag site region ship sourc earlier said three iranian offshor oil site sassan rostam rakhsh attack gmt monday unidentifi aircraft washington u defenc secretari caspar weinberg said four u destroy attack destroy iranian oil platform mile east bahrain
407,walmart store inc rais quarterli qtli div six ct v ct prior pay april record march
408,u busi loan fall mln dlr feb week fed say u busi loan fall mln dlr feb week fed say
409,aerospac ltd year net shr basic ct v dlr shr dilut ct v dlr net v rev mln v mln
410,bel fuse inc th qtr net shr ct v ct net v sale v year shr ct v ct net v sale mln v mln
411,studi say oil price fall spur bankruptci sharp drop world oil price past year trigger pct increas bankruptci countri oil state accord studi releas american petroleum institut api api said dunn bradstreet studi found busi failur rose nation pct oil patch southwest increas pct said bankruptci texa pct oklahoma pct colorado pct louisiana pct alaska failur rose per cent said api also said three state highest number bank failur last year larg oil ga produc texa oklahoma kansa
412,western canada hurt intern forc western canada resourcebas economi hurt intern market forc littl ottawa financ minist michael wilson said tell get intern energi price get price copper get price wheat listen wilson told hous comnon financ committe although pressur oil compani wheat farmer help battl depress commod price wilson said recogn area prison market forc outsid boundari countri wilson appear committe discu govern spend estim releas earlier week said govern region cite billion dlr aid western agricultur resourc reflect real concern part deal difficult problem wilson said respons question manag economi opposit parti member said long term answer depress region countri reach free trade pact unit state claim would improv outlook western canada
413,nigeria chang auction rule defend naira nigeria central bank chang rule govern foreign exchang auction analyst see mean defend naira currenc depreci steadili bank said statement april bank bid foreign exchang would pay rate offer present rate lowest success bid made auction discourag bank bid high ensur success pay lower margin rate analyst said act brake bank know bid high pay offer western diplomat comment naira depreci dollar pct sinc auction known secondti foreign exchang market sfem began last septemb last week session nigerian currenc fix dollar third fall row clearli worri logic way tri stop trend diplomat said central bank also announc auction would fortnightli weekli begin april immedi clear whether next thursday schedul session would still take place bank plan doubl mln dlr normal offer auction demand foreign exchang consist outstrip suppli encourag bank bid high thu weaken naira normal weekli alloc doubl fortnightli session high demand could undermin object new system analyst said although bid bank pay offer offici exchang rate naira appli busi transact continu margin rate lowest success bid sfem central part nigeria structur adjust program consid ambiti econom recoveri plan black africa program involv set realist exchang rate naira overvalu mani year liberalis import boost agricultur remov subsidi reduc ineffici govern particip economi world bank play promin part design dramat blueprint sell often sceptic public fear inflat lower live standard ishrat husain world bank repres nigeria said yesterday satisfi adjust program whole foreign exchang auction far good told meet banker lago ad member nigeria importdepend elit would suffer hardship common man would benefit fear program would encourag inflat incorrect said bumper harvest reduc rural inflat urban price alreadi reflect naira black market valu currenc allow find true level last septemb
414,salant file reorgan plan salant corp said thomson co inc obion co inc subsidiari file joint reorgan plan u bankruptci court expect emerg chapter bankruptci near futur compani said hear adequaci associ disclosur plan schedul april nine complet plan subject approv creditor equiti secur holder bankruptci court salant said reach agreement ray w william continu presid chief execut offic five year effect date reorgan plan substanti conclud talk new mln dlr unsecur credit effect date compani said committe unsecur creditgor committe equiti secur holder approv term plan previous announc creditor receiv mln dlr cash dlr pct senior subordin debentur four common share dlrsd allow unsecur claim salant today report earn year end novemb dlr dlr pretax provis loss sale subsidiari dlr posttax charg attribut cost expens chapter settlement prechapt claim well dlr tax credit year lost dlr dlr pretax provis plant close
415,pari trade detail ec grain tender result ec commiss reject bid free market breadmak feed wheat bid special west german tender today weekli ec cereal tender trade sourc said grant export licenc tonn free market barley maximum rebat ecu per tonn tonn maiz maximum rebat ecu said licenc tonn barley award french trade hous ad
416,west german fishmeal import highest year west german gross fishmeal import rose tonn pct last year tonn highest level sinc trade sourc said reexport fell pct result surg net import tonn increas pct total west german consumpt estim around high tonn larg reflect attract price sourc howev could give compar figur south american produc countri suppli pct west german requir chile ship tonn peru tonn two south american countri share west german market rose pct pct import ecuador fell tonn west germani import tonn fishmeal decemb tonn month reexport tonn year earlier
