,0
0,telecommun sell cabl system knightridd inc said tkr cabl co joint ventur telecommun inc sign letter intent acquir cabl televis system basic subscrib wildwood nj ramapo warwick ny telecommun undisclos term
1,un issu report natur ga claus un centr transnat corpor issu report contain guidelin recommend negoti natur ga claus agreement transnat petroleum corpor host countri un said report aim promot petroleum explor area perceiv ga prone page report contain indepth examin problem ga developo look differ way contractu term might deal risk ga develop associ price market volum
2,bicc plc year shr p v p final div p make p v p pretax profit mln stg v mln attribut profit mln v mln turnov billion stg v billion
3,commerci credit unit sell divis commerci credit co said american health life insur co sold ordinari life insur busi american nation insur co american nation assum busi later august commerci credit said sale part restructur program begun commerci credit subsidiari late compani said
4,southmark offer special dividend southmark corp said issu sharehold special dividend right acquir share american realti trust share southmark right entitl holder buy one share benefici interest american realti trust price dlr per share southmark said southmark said offer record date may exdividend date april ad issu right sharehold may offer expir may southmark said receiv right april holder pct american realti trust outstand share holder fewer southmark share would receiv right acquir fewer american realti share paid cash lieu right distribut compani said southmark said comput cash price paid base averag close market price right american stock exchang first ten day right trade begin april order get dividend right southmark sharehold must common stock exdividend date april compani said southmark said common stock trade exright basi
5,alfin inc nd qtr jan loss shr loss ct v profit ct net loss v profit rev v avg shr v six mth shr loss ct v profit ct net loss v profit rev mln v mln avg shr v
6,henri ansbach pct adam porter inc ansbach hold plc said acquir pct interest u retail gener corpor insur broker porter inc move first step build new intern insur broke group follow appoint new manag team seascop insur hold unit ansbach said p excit growth potenti particularli east coast u annual revenu four mln dlr ansbach share p help announc earlier today pretax profit rise mln stg mln
7,product inc six mth dec loss shr loss ct loss rev note initi public list decemb
8,circu circu enterpris th qtr net oper shr ct v ct oper net v rev mln v mln year oper shr ct v one dlr oper net v rev mln v mln note current qtr year figur exclud extraordinari loss earli debt retir mln dlr five ct per share mln dlr ct per share respect full name circu circu enterpris inc
9,sunstar food inc nd qtr feb net shr ct v report net v sale mln v mln six mth shr ct v ct net v sale mln v mln note six month net includ loss discontinu oper equal two ct share net includ loss discontinu oper four ct quarter six ct six month
10,earli march opec output seen well ceil opec crude oil output first day march run mln bpd mln bpd averag februari well mln bpd ceil group adopt decemb reuter survey show figur poll reuter correspond oil trader industri execut analyst europ middl east africa latin america asia back recent statement opec minist group produc within ceil support return fix price system came effect last month opec output whole februari bpd ceil larg overproduct unit arab emir kuwait figur show uae togeth much smaller produc ecuador also produc quota first day march survey reveal overproduct compens sharp fall saudi arabian output togeth iran inabl export much quota allow iraq reject opec quota mln bpd produc mln bpd februari earli march figur show saudi output exclud movement stock fell mln bpd earli march mln bpd februari mln bpd quota saudi figur includ bpd share neutral zone product kuwait consist deni quota violat estim pump mln bpd februari earli march figur includ bpd share neutral zone output bpd quota report custom resist fix price set opec state reflect output qatar nigeria substanti quota februari earli march qatar februari output bpd fell bpd earli march compar bpd quota industri sourc say japanes buyer resist qatar price gulf arab oil state pledg make shortfal sale fellow gulf state suffer nigeria earli march output one mln bpd mln bpd februari quota mln bpd industri sourc say nigeria custom believ bonni grade overpr compar compat brent crude uk north sea countrybycountri product figur follow mln bpd countri current februari quota algeria ecuador gabon indonesia iran iraq kuwait libya nigeria qatar saudi arabia uae venezuela total reuter
11,ultramar plc year shr p loss v p earn div p make p v p net loss mln stg v mln profit oper profit tax mln v mln turnov billion v billion cost sale billion v billion gross profit mln v mln distribut cost administr expens mln v mln share profit associ mln v mln oper incom mln v mln financ charg mln v mln tax mln v mln except item mln debit v mln debit net result discontinu oper mln debit v mln debit loss ordinari activ minor interest mln v mln profit minor interest mln v mln extraordinari debit mln v nil
12,lloyd bank match base rate cut pct lloyd bank plc said cut base lend rate pct pct effect tomorrow reduct follow similar move three british clear bank nation westminst bank plc led way morn bank england lower deal rate signal would toler half percentag point reduct central bank surpris signal follow strenuou effort last week prevent market forc bring base rate uk budget march
13,aw comput system inc year end dec shr ct v ct net v rev v
14,baldrig say u go ahead japanes sanction baldrig say u go ahead japanes sanction
15,musicland group inc rd qtr net shr ct v ct net v rev mln v mln avg shr mln v nine mth shr ct v ct net v rev mln v mln avg shr mln v note compani pct own primerica corp
16,teleconcept corp rd qtr net shr profit ct v profit one ct net profit v profit sale v avg shr v nine mth shr profit ct v loss ct net profit v loss sale mln v avg shr v backlog v
17,royal dutch rd unit rais heavi fuel price scallop petroleum corp subsidiari royal dutchshel group said rais contract price heavi fuel ct one dlr barrel effect tomorrow increas bring price pct sulphur fuel dlr ct pct sulphur dlr ct pct sulphur dlr ct one pct sulphur dlr ct two pct sulphur dlr one dlr pct sulphur dlr one dlr pct sulphur dlr one dlr compani said price pct sulphur unchang dlr said
18,outokumpu copper deal iberica del cobr finland stateown mine compani outokumpu oy said statement enter spanish market sharehold iberica del cobr sa manufactur copper product outokumpu acquir pct share spanish compani compani set agent outokumpu spain deal await approv spanish govern iberica del cobr make tube rod roll drawn copper alloy product sale tonn output amount billion peseta outokumpu turnov billion markka
19,cyclop name dixon offici board cyclop corp said reconstitut board includ three group plc execut follow dixon acquisit pct cyclop share dlr per share tender offer cyclop said remain sixmemb board chairman chief execut wh knoell presid chief oper offic jame f senior vice presid william dickey
20,mott super market inc th qtr jan shr loss ct v loss dlr net loss v loss mln rev mln v mln year shr loss ct v loss dlr net loss mln v loss mln rev mln v mnln
21,icco buffer stock manag buy tonn cocoa tuesday june offici icco buffer stock manag buy tonn cocoa tuesday june offici
22,mf manag sector trust dividend increas semiannu div incom ct v cent prior period payabl march record februari
23,major nation must act currenc miyazawa financ minist kiichi miyazawa said time come major industrialis nation take action exchang rate line agreement last month pari pari britain canada franc japan u west germani agre coooper hold currenc rate around current level miyazawa would say specif measur major nation would take told report measur discuss pari dollar fell record low yen morn pierc yen barrier
24,town countri jewelri manufactur thh qtr feb shr ct v ct net v sale mln v mln avg shr v year shr dlr v dlr net v sale mln v mln avg shr v note town countri jewelri manufactur corp
25,best product co th qtr jan net shr profit dlr v profit ct net profit mln v profit mln sale mln v mln year shr loss ct v profit eight ct net loss mln v profit sale v note current year net period includ prtax provis restructur oper dlr quarter mln dlr year latest year net includ dlr tax credit dlr posttax loss debt extinguish
26,japan ntt forecast profit fall telegraph telephon corp ntt expect profit fall billion yen year end march project billion year compani said total sale period expect rise billion yen project billion year ntt said busi oper plan submit post telecommun ministri ntt said plan make capit invest billion yen includ billion research develop total billion year
27,bank japan buy dollar around yen dealer bank japan buy dollar around yen dealer
28,japan care consid money polici sumita bank japan governor satoshi sumita said central bank care consid monetari polici light recent sharp fall dollar ask bank japan consid cut discount rate said think bank care consid futur money polici told lower hous budget committe parliament credit condit eas five discount rate cut japan sinc begin last year japan must especi care flareup inflat money suppli growth acceler said sumita said central bank would continu make judgement monetari polici watch consum price exchang rate econom financi condit outsid japan ask septemb plaza agreement failur dollar fallen far sumita said still thought pact good one sens correct overvalu dollar plaza accord set target dollar fall said dollar steep fall stem market belief trade imbal continu expand said
29,manhattan natl holder vote stock sale manhattan nation corp said sharehold overwhelmingli approv propros central life insur co took control compani acquir mln share newli issu manhattan nation common stock mln dlr compani said transact give union central cincinnatibas mutual insur compani total share manhattan nation stock pct total outstand manhattan nation said three mln dlr invest fund use repay shortterm debt two mln dlr earmark shortterm need remaind avail compani insur unit busi purpos said charl c hinkley presid chief execut offic union central expect name chairman presid chief execut manhattan nation compani said
30,argentin veget oil shipment argentin veget oil shipment januarydecemb total tonn tonn period argentin grain board said breakdown follow cotton sunflow linse groundnutse soybean tung oliv maiz rape nil nil grape nil nil board ad shipment decemb amount tonn tonn month breakdown follow tonn cotton nil sunflow linse groundnutse nil soybean tung oliv maiz nil rape nil nil grape nil nil board said ten princip destin januarydecemb compar figur period bracket follow tonn iran holland soviet union egypt algeria south africa brazil cuba unit state india board said
31,dna medic sign pact stock sale dna medic inc said walter g mize bought share pct dna outstand stock dlr cash agreement mize dna said also becom chairman may option expand board provid equal represent current board dna also said submit propos annual meet acquir three compani own mize lite meat corp lean beef corp cattl dna said total valu transact dlr dna said transact approv sharehold issu addit share common mize pct issu outstand stock dna said mize replac current chairman donald holbrook remain board compani also said continu medic develop busi long deem advantag
32,dune resourc ltd th qtr net shr profit one ct v loss two ct net profit v loss rev v year shr loss eight ct v loss three ct net loss v loss rev v
33,rio de janeiro docker strike rio de janeiro dockwork went strike indefinit period today demand wage increas spokesman docker said rio docker get support colleagu santo brazil main port spokesman said would return work unless demand met earlier week dockwork cancel schedul nation strike pressur port offici give wage increas benefit rio port spokesman said halt would caus daili loss u dlr
34,bank franc cut intervent rate bank franc said cut money market intervent rate pct eight pct inject money first categori paper bank also cut sevenday repossess rate pct pct intervent rate stood eight pct sinc rais pct januari french franc came pressur ahead em realign januari bank said purchas effect tomorrow five pct privat paper fix rate treasuri bill matur march june treasuri bill matur march march rate cut expect sinc bank announc money market intervent tender earlier today money market dealer said condit seem right quarter percentag point cut reflect eas call money rate last week french franc steadi foreign exchang market sinc februari currenc stabilis accord group five canada
35,geneva negoti un confer agre basic element new rubber pact chairman geneva negoti un confer agre basic element new rubber pact chairman
36,group five meet end meet financ minist central banker group five end nearli three half hour west german financ minist gerhard stoltenberg british chancellor exchequ nigel lawson declin comment meet emerg u treasuri european monetari offici said minist group seven countri would gather three pm local gmt treasuri
37,icco buy tonn cocoa buffer stock intern cocoa organ icco buffer stock manag bought tonn cocoa today buffer stock trader said cocoa believ entir made second hand materi ad purchas would bring cumul buffer stock purchas tonn
38,interco inc th qtr feb net shr ct v ct net v sale mln v mln year shr dlr v dlr net v sale billion v billion note result reflect twoforon stock split juli
39,consolid professor st qtr net shr profit one ct v nil net profit v loss rev v note full name consolid professor mine ltd
40,athey product corp rd qtr net shr ct v ct net v rev mln v nine mth shr dlr v ct net v rev mln v mln
41,fieldcrest cannon inc set quarterli qtli div ct v ct prior pay march record march
42,ford europ earn pct last year ford europ net earn soar per cent last year mln dlr kenneth whippl chairman ford europ said whippl attend geneva auto show open thursday said ford motor co unit sold record million vehicl europ net earn mln dlr sale repres per cent european market share whippl said ford invest billion dollar europ total seven billion next seven year ad
43,american medic intern inc nd qtr shr profit ct v loss ct american medic intern inc nd qtr shr profit ct v loss ct
44,biomet inc rd qtr feb net shr ct v ct net v rev mln v mln nine mth shr ct v ct net v rev mln v mln
45,malaysian econom growth seen forecast develop bank singapor ltd db said malaysia real gross domest product growth gdp could two pct budget target one pct said report econom recoveri higher foreign exchang reserv malaysian ringgit unlik face devalu near futur report present twoday invest confer organis db one singapor four major bank report said rise commod price continu expans manufactur sector coupl rigor fiscal restraint stabl currenc ground cautiou optim malaysian economi forecast ringgit remain stabl malaysian dlr u dollar rest year report said growth rate malaysia extern debt remain worri control said malaysia extern debt total billion malaysian dlr debt servic ratio exce pct
46,enseco inc th qtr loss oper shr loss six ct v profit seven ct oper net loss v profit rev v avg shr mln v mln year oper shr loss six ct v profit ct oper net loss v profit rev mln v mln avg shr mln v mln note exclud extraordinari credit four ct share fourth quarter ct year
47,bhp merg bhp miner utah intern broken hill pti co ltd said merg bhp miner divis intern inc singl busi unit common manag structur merger effect june coincid retir utah intern chairman chief execut bud wilson bhp said statement new bhputah miner intern group head jim curri execut gener manag chief execut offic curri current execut vicepresid utah intern bhp said petroleum america inc formerli part utah intern becom subsidiari bhp renam petroleum intern petroleum pti ltd compani said bhp also bring queensland coal oper one manag structur consolid miner market sale offic variou market throughout world bhp acquir utah gener electr co utah asset includ stake pct seven larg central queensland coke mine pct samarco iron ore oper brazil pct la escondida copper deposit chile island copper mine port hardi canada pct coal mine pct gold mine south africa coal mine u bhp miner asset includ wholli partlyown iron ore mine coal mine manganes basemet oper prospect pct ok tedi goldcopp project papua new guinea
48,wgerman cocoa grind pct first quarter west german cocoa grind rose pct tonn first quarter tonn quarter bonnbas confectioneri industri associ said statement reuter taw
49,current exchang rate almost within level agre major nation sumita current exchang rate almost within level agre major nation sumita
50,u warn depend foreign oil white houseord report said grow u relianc foreign oil year could potenti damag implic nation secur energi depart studi discu sever option curb relianc foreign oil make recommend presid reagan congressman previous rule tax foreign oil way curb import help depress domest oil industri energi secretari john herrington said statement although made gain energi secur last six year report show justif nation concern declin competit domest oil ga industri rise oil import report said import last year pct u consumpt mid could rise pct among report option eas u relianc foreign oil sever alreadi advoc reagan administr presid reagan order studi last septemb cite determin countri never becom captiv foreign oil cartel refer opecl oil shortag sharp price increas report said import fee would rais price help make econom u oil firm find produc new oil well cut import whole tax would depress nation economi
51,canada bank could see pressur brazil loan canada major bank like face stiff pressur declar brazilian loan nonperform expect major u bank take similar action end first quarter tomorrow analyst said american banker said last week slow progress debt talk brazil increas likelihood u bank would soon declar brazilian loan nonperform action would put lot pressur canadian bank levesqu beaubien inc torontobas bank analyst donna pulcin told reuter bank like appear conserv said pulcin major bank put loan nonperform basi canadian bank dont go lot pressur sharehold one bank consid loan nonperform anoth bank wood gundi inc bank analyst patricia meredith said willing major brazilian bank creditor citicorp declar brazilian loan nonperform rather let brazil dictat settlement term would provid compel exampl creditor bank order make strategi work citicorp support bank said meredith bank analyst michael walsh first marathon secur ltd said least one canadian bank declin identifi want put brazilian loan nonperform basi tri encourag other take posit canadian bank owe seven billion canadian dlr brazil late last month suspend interest payment billion u dlr foreign bank debt bank canada although allow wait day declar loan receiv interest nonperform usual move loan within day could therefor delay action brazilian loan late may fall canadian bank third quarter end juli montreal brazil largest canadian bank creditor said last week current consid declar billion dlr brazilian loan nonperform think benefit public walsh said bank montreal statement analyst predict minim earn impact canadian bank move declar brazilian loan nonperform said brazil would like resum interest payment bank fiscal yearend octob thu allow bank recoup lost interest incom brazil said quit like bank get money said meredith outlook point optimist adjust fullyear earn meredith forecast fulli dilut per share earn dlr bank canada compar dlr montreal compar dlr imperi bank commerc compar dlr nova scotia compar dlr dominion bank forecast dlr bank canada dlr two one stock split analyst pulcin said might lower fullyear earn estim bank two ct ct share assum possibl settlement reduc brazil interest cost bank didnt receiv anyth rest fiscal year impact could rang ct ct share dont see like scenario pulcin said walsh first marathon suggest howev brazilian debt situat complex could drag beyond one full fiscal year said foresaw lower fiscal earn forecast bank estim brazil yearli interest payment canadian bank total mln dlr pct total pretax earn
52,italian net offici reserv fall may itali net offici reserv fell billion lira may previous report billion april bank itali said gold hold total billion lira end may unchang end april convert currenc total billion lira may billion april european currenc unit hold billion billion
53,u energi cost rose februari pct consum energi cost rose pct februari follow sharp rise last month labor depart said februari increas overal energi cost includ petroleum coal natur ga follow pct drop decemb pct rise januari said energi price pct yearago level depart consum price index show cost gasolin rose februari pct pct rise januari gasolin price nonetheless pct level februari also categori includ fuel oil coal bottl ga rose februari pct put pct yearago figur index also show natur ga electr unchang last month pct februari figur depart said index updat reflect consumpt pattern previous index base pattern
54,lawson welcom reaffirm louvr accord uk chancellor exchequ nigel lawson welcom monday reaffirm u west germani louvr accord aim stabilis currenc offic said lawson welcom outcom meet u treasuri secretari jame baker bundesbank presid karl otto poehl west german financ minist gerhard stoltenberg frankfurt meet bonn financ ministri spokesman quot stoltenberg say confid foreign currenc could stabilis around current level meet came baker criticis west germani increas key interest rate say line last februari louvr accord
55,uk money market shortag forecast mln stg bank england said forecast liquid shortag around mln stg market today among main factor bank said bill matur offici hand treasuri bill takeup would drain mln stg system target banker balanc rise note circul would take mln mln stg respect partial offset exchequ transact would add around mln stg bank ad
56,itt corp regular qtrli dividend qtli div ct v ct prior payabl juli one record may
57,zenith nation insur qtli dividend shr ct v ct prior qtr pay may record april note full name zenith nation insur corp
58,great countri bank rd qtr net qtr end feb shr ct v na net v nine mth shr dlr v na net v asset mln v mln deposit mln v mln loan mln v mln note earn per share data present great countri bank convert mutual capit stock save bank jan inform mislead inappropri compani said
59,home feder savingsrocki rd qtr shr ct v nil net v nine mth shr dlr v ct net v asset mln v mln note full name compani home feder save loan associ rocki
60,hanson unit sell kaiser terminalpl hanson industri u arm hanson trust plc said propos sell separ transact kaiser cement northwest termin montana citi plant lone star industri inc grove cement west inc respect total mln dlr hanson said deal subject normal condit close hanson industri complet purchas kaiser cement march mln dlr hanson said kaiser cement indirect wholli own unit hanson trust form part build product group sale continu asset redeploy program kaiser cement allow kaiser concentr effort california marketplac largest cement produc hold premier market posit hanson industri chairman gordon white said
61,union protest dart supermarket bid unit food commerci worker said rankandfil member union demonstr monday dart group corp headquart protest dart propos billion dlr takov supermarket gener supermarket best known pathmark chain supermarket drug store new york new jersey area also own rickel home center union said firmli dart bid worker alway end raw deal current takeov mania union statement said intend allow member pick tab supermarket gener execut banker dart group stand make million dart control haft famili washington last year made bid californiabas safeway store inc haft lost walk away least mln dlr profit analyst estim union said dart safeway bid forc major restructur safeway pay haft lawyer caus loss thousand job
62,p f industri inc th qtr net oper shr ct v ct oper net v rev mln v mln avg shr v year oper shr ct v ct oper net v rev mln v mln avg shr v note net exclud tax credit dlr v dlr quarter dlr v dlr year share adjust oneforf revers split octob
63,morgan bank plan warrant gold dlr morgan guaranti trust co new york plan issu warrant gold bullion dlr ounc lead manag morgan guaranti switzerland ag said warrant price swiss franc entitl holder acquir fiveounc bar gold period april juli exercis wednesday warrant repres unsecur unsubordin liabil borrow payment due april quotat luxembourg bours plan warrant exercis would repaid current dollar base valu gold exercis date condit repres premium dlr ounc current gold price morgan switzerland offici said basi matur four year three month price involv implicit volatil gold pct warrant money compar implicit volatil pct indosuez gold warrant pct citibank gold warrant recent issu matur month
64,healthvest buy tennesse medic complex healthvest said acquir eastwood hospit medic complex memphi healthcar intern inc mln dlr cash healthcar intern continu oper hospit leas agreement compani said
65,counti increas tesco stake hillard ltd act concert tesco plc mln stg supermarket chain oper plc purchas hillard ordinari share p per share statement said purchas togeth made counti march repres pct hillard issu ordinari share capit said tesco offer made march valu hillard ordinari share p pct premium previou day close price cash altern p made avail
66,inc year net shr ct v dlr net v rev v note shr novemb class subordin float share issu
67,kirin breweri co ltd year januari parent shr yen v div yen v net billion v billion current billion v billion oper billion v billion sale billion v billion outstand shr mln v mln note dividend includ two yen bonu dividend mark th anniversari compani forecast current year parent shr yen div yen net billion current billion sale billion
