,0
113,rowntre report pretax profit mln stg rowntre mackintosh plc announc made pretax profit mln stg week end januari compar mln stg previou year turnov billion stg billion final dividend p propos final p last year earn per share rose p p result broadli line market expect leav share p earli trade one penni yesterday close slightli preannounc open level profit ordinari activ tax mln stg previou year mln uk remain rowntre largest centr trade profit account mln stg mln profit second largest geograph area north america slip mln stg mln north american profit affect fall valu dollar oper continent europ made mln stg trade profit mln mln stg made australasia mln mln stg rest world mln previou year extraordinari item amount mln debit mln debit previous compani spokesman said repres addit provis cost rationalis plan announc earlier year rowntre expect north american oper year ahead compani expect order uk rest europ combin statement said spokesman said specif figur forecast acquisit continu sought worldwid includ move special retail busi rowntre first enter statement said rise profit europ year forecast chairman kenneth dixon statement ad perform seven busi bought last year encourag uk confectioneri side gain market share increas trade margin sunpat british groceri concern increas profit rowntre small health food busi holgat rais earn fold statement said offset factor includ currenc movement cost compani nearli mln stg sale tax hurt canadian profit confectioneri oper compani face strong competit uk snack mid east export market
114,somerset bancorp inc rd qtr net net v nine mth shr dlr v dlr net v asset mln v mln note per shr data qtr disclos
115,intervent dollar fix mark bundesbank interven dollar fix lower mark yesterday dealer said
116,driverharri co th qtr net shr profit ct v loss dlr net profit v loss rev mln v mln avg shr mth shr profit ct v loss dlr net profit v loss rev mln v mln avg shr v note net loss yr qtr includ charg ct per share expens relat restructur compani domest alloy busi
117,may depart store co rais dividend qtli div ct v ct previous pay june record june one
118,bemi co rd qtr net shr ct v ct net v sale mln v mln nine mth shr dlr v dlr net v sale mln v mln
119,walker telecommun corp th qtr shr loss ct v loss nil net loss mln v loss rev mln v mln year shr loss ct v profit four ct net loss mln v profit rev mln v mln note th qtr loss includ loss mln dlr discontinu oper th qtr includ loss dlr discontinu oper th qtr includ mln dlr provis cost anticip connect dispos divis dlr adjust relat writedown th qtr includ gain dlr exchang telephon inventori barter credit
120,maxtor corp buy privat firm maxtor corp said bought privatelyheld storag dimens inc undisclos sum compani said storag dimens incorpor maxtor highcapac inch winchest optic disk drive famili data storag subsystem ibm pc xt at compat storag dimens creator speedstor softwar util program integr highcapac disk drive pc maxtor said purchas reflect desir compet highcapac segment pc market
121,newport pharmaceut rd qtr loss period end januari shr loss six ct v profit one ct net loss v profit rev v avg shr v nine mth shre loss nine ct v loss five ct net loss v loss rev v avg shr v note full name newport pharmaceut intern inc
122,rpc energi servic inc st qtr sept shr profit one cent v loss ct net profit v loss rev mln v
123,nz chase corp make offer entregrowth chase corp ltd said make offer fullypaid share option intern ltd alreadi chase properti invest firm said hold pct entregrowth vehicl expans north america said agreement conclud give benefici pct interest offer remain share one chase share everi three entregrowth share one chase option everi four entregrowth option chase share close friday dlr option entregrowth close dlr option cent chase said offer remain pct entregrowth worth mln dlr involv issu mln chase share mln chase option chase chairman colin reynold said takeov would allow entregrowth concentr north american oper access chase intern fund base stronger execut team said also would benefit integr new zealand invest activ chase said offer condit receiv accptanc least pct share option
124,philippin trade secretari pleas gatt talk philippin secretari trade industri jose concepcion two day ago express doubt agreement produc intern confer said pleas latest gather concepcion told reuter interview inform gener agreement tariff trade gatt meet gave minist nation chanc examin issu gatt polit deal also role develop countri emphasis particular meet somehow percept develop countri gatt club rich countri ad interview reuter fact mani issu tabl discuss uruguay round trade negoti benefit develop countri said concepcion said start taupo meet uruguay round meant shine act faith world trade system concepcion said philippin would address issu trade tropic fruit improv gatt machineri make respons said tropic fruit came develop countri face nontariff barrier quantit restrict high duti nation concepcion name japan south korea exampl said would go wellington talk new zealand surplu trade philippin encourag switch import countri note new zealand bought banana ecuador
125,hei corp th qtr march loss oper shr loss ct v profit three ct oper net loss v profit rev mln v mln year oper shr loss nine ct v profit ct oper net loss v profit rev mln v mln note revenu exclud medic publish retail oper compani decid dispos fourth quarter fiscal year revenu mln dlr v mln dlr oper result exclud discontinu oper year loss dlr v profit dlr
126,ausimont compo nv th qtr net shr ct v ct net mln v sale mln v mln avg shr mln v mln year shr dlr v dlr net mln v mln sale mln v mln avg shr mln v mln note translat italian lira dollar
127,green tree accept inc set dividend qtli dividend ct v ct pay march record march
128,canada februari consum price pct canadian consum price index rose pct februari base compar pct rise januari pct rise februari last year statist canada said februari yearon year rise pct compar pct rise januaryr
129,sterivet set threeforon share split sterivet laboratori ltd said board author threeforon split outstand common share subject sharehold approv annual meet
130,coca cola enterpris inc rd qtr net shr ct v ct net mln v mln rev mln v mln avg shr mln v mln nine mth shr ct v ct net mln v mln rev billion v billion avg shr mln v mln note result includ acquir bottl compani date acquisit pro forma basi acquisit place start period compani earn dlr four ct per share mln share outstand revenu mln dlr quarter earn mln dlr ct per share number share revenu billion dlr nine mth
131,oecd see major adjust australia australia face major medium term adjust reduc debt improv econom perform organis econom cooper develop said latest annual review australian economi said australia current extern deficit pct gross domest product high rapidli rise extern debt equal pct gdp grow servic cost inflat nine pct far higher oecd countri major polici chang earli help lay basi sustain noninflationari growth extern competit improv econom perform overal sharpli deterior sinc june major shift real resourc extern sector pct gdp requir economi expand line potenti employ grow debtgdp ratio stabil said success depend set right polici includ tighter fiscal polici reduct public sector borrow requir privat sector behaviour look ahead next month oecd expect econom perform improv partli result tighter fiscal monetari polici substanti improv trade volum said posit gdp growth three pct might restor current extern deficit could fall pct gdp first half next year inflat project deceler around five pct mid continu real wage moder essenti maintain competit edg creat australian dollar depreci maintain boost profit share order encourag busi invest report urg australia broaden export base develop viabl competit servic manufactur industri count recoveri commod market correct extern imbal ad australia reduc protect level manufactur even though faster trade liberalis would doubt hurt protect sector industri
132,usx unit rais steel price usx corp said us steelmak divis increas price plate hpile product effect may three shipment said price base carbon highstrength lowalloy hsla hpile increas ct per pound effect shipment begin june price carbon hsla alloy plate increas ct per pound strip mill plate price rise ct per pound said price increas plate hpile product appli shipment us plant
133,francogerman parley fail unblock farm talk special conven francogerman meet sidelin summit ec leader fail make progress farm price packag deepli split two former ec alli diplomat said meet attend farm minist foreign minist countri french presid francoi mitterand prime minist jacqu chirac chancellor helmut kohl west germani stalem farm price seen key provid solut longterm settlement commun worstev budget crisi german clearli want budg aid chirac told report ad french prime minist visibl anger hourlong meet bonn pari diametr oppos propos brussel execut commiss overhaul radic ec complex green currrenc system design translat common ec farm price nation currenc pari also support move oil fat tax west germani along britain denmark netherland ec farm minster due resum negoti packag agre april deadlin tomorrow diplomat said hope summit could inject fresh impetu talk commiss propos packag save one billion dollar ec everris farm budget summit domin lengthi talk move alter entir system financ nation group plug billion dollar budget shortfal
134,german veba placement said like earli next week placement german feder govern pct stake util veba ag would probabl take place earli next week bank sourc said share dealer said specul arisen earli prebours market veba announc could come earli today one bank sourc though confirm detail work said chanc announc today nil price detail mln share offer expect bring cash call germani well two billion mark share around mark today drop yesterday
135,nation intergroup unit rais crude price permian corp subsidiari nation intergroup said rais crude oil post ct barrel effect june compani said new post price west texa intermedi west texa sour dlr barrel light louisiana sweet price hike follow increas industrywid
136,health group limit qtli payout qtli div six ct v six ct prior pay april one record march
137,australia lead index continu rise decemb westpac bank corp melbourn univers institut appli econom social research said lead index australian econom activ rose ninth success month decemb index rose base novemb year earlier westpacinstitut report said annualis rose pct decemb seven pct novemb one pct year earlier base ratio latest index averag previou month report said index point pct trough march westpac chief economist bob graham said consist upward trend lead index emphasis need tough minibudget may untoward increas consumpt spend balanc payment improv would disastr consequ said coincid index also rose annualis three pct decemb zero movement novemb seven pct rise year earlier westpac institut said said index continu show current recess shallow like involv slow real growth absolut fall econom activ
138,uk money market given mln stg assist bank england said gave money market assist worth mln stg afternoon buy bank bill rate establish monday bank bought mln stg band one bill pct mln stg band two paper pct first time interven today bank revis estim liquid shortag market mln stg mln initi
139,canada gdp rise pct canada real gross domest product season adjust rose pct fourth quarter growth previou quarter statist canada said left growth full year pct four pct increas rise also slightli pct growth rate financ minist michael wilson predict februari budget also forecast gdp would rise pct statist canada said final domest demand rose pct final three month year pct gain third quarter busi invest plant equip rose pct fourth quarter partli revers cumul drop pct two previou quarter
140,taiwan issu cd curb money suppli growth central bank issu billion dlr worth certif deposit cd bring valu cd issu far year billion bank spokesman told reuter new cd matur six month one year two year carri interest rate rang pct issu design help curb growth mb money suppli expand along taiwan foreign exchang reserv spokesman said reserv reach record high billion u dlr wednesday
141,lennar see strong earn year lennar corp chairman presid leonard miller said current backlog order strong economi point strong revenu earn balanc fiscal said compani backlog sale deposit feb increas unit previou year lennar record net earn first quarter ct per share compar ct per share prior first quarter record net earn mln dlr dlr per share fiscal compani also said april annual meet sharehold vote increas compani author common stock mln share mln includ mln share common stock mln share class b common stock ad sharehold elect convert share class b stock entitl vote per share sharehold retain one vote per share lennar said compani said approv intn pay holder class b stock quarterli cash dividend five ct per share holder common stock quarterli cash dividend six ct per share
142,ropak pct buckhorn ropak corp said receiv accept common share seri convert prefer share buckhorn inc four dlr dlr respect respons tender offer expir friday own pct buckhorn vote power compani own common prefer share start hostil tender ropak said borrow fund need buy buckhorn share bank lender need use fund anoth bank commit provid margin loan ropak said waiv minimum accept requir buy share intend evalu number possibl way complet acquisit buckhorn said hope buckhorn board reevalu posit enter meaning negoti
143,trustco inc th qtr net shr ct v nine ct net v rev given year shr dlr v ct net v rev mln v mln note shr prefer dividend
144,corpor softwar inc rd qtr net shr ct v ct net v rev mln v avg shr v nine mth shr ct v ct net v rev mln v mln avg shr v note includ extraordinari credit six ct per shr qtr ct per shr nine mth
145,dutch sugar trade deni involv offer dutch sugar trader deni involv plan offer tonn sugar intervent protest ec export polici price trader told reuter although tonn sugar offer intervent netherland dutch produc trader said sugar actual belgian offer belgian industri sympathis action french west german belgian trader produc parti spokesman said ec commiss sourc said yesterday french trader plan sell tonn intervent stock west german trader tonn dutch trader dutch trade sourc gave figur franc estim tonn offer german trader produc dutch spokesman ad weekli export tender polici price squeez european sugar industri way realli regist protest desper action believ offer sugar withdrawn within threeweek breath space allow
146,tiecommun renew agreement tiecommun inc said renew agreement sell gte corp bell atlant corp nynex corp u west inc two year compani provid small midsiez key telephon system gte key system hybrid data star pabx system other
147,cpc intern inc regular dividend qtli div ct v ct prior pay april record march
148,ph glatfelt acquir ecusta ph glatfelt co said reach agreement acquir capit stock corp dlr cash glatfelt print write paper maker said ecusta oper uncod three sheet lightweight specialti paper mill pisgah forest nc mill produc convert paper product use doemstic foreign tobacco industri glatfelt said expect close deal may
149,nation bank new zealand ltd year decemb net profit mln nz dlr v mln pretax profit mln v mln total asset billion v billion note compani pct own lloyd bank plc result includ time first pretax profit mln nz dlr australian unit bank nza ltd
150,reason cut rate bundesbank schlesing bundesbank vice presid helmut schlesing said saw reason lower interest rate money suppli growth show sign slow may dollar stabl even rise mark schlesing told reuter convinc cut interest rate need economi pick contract season adjust one pct first quarter fourth ad may increas gnp start second quarter said interview concern first quarter downturn u press west germani pump economi boost import either fiscal monetari polici schlesing said contract first quarter mainli due advers weather condit occur yearonyear growth thu two pct estim econom growth year whole would probabl one two pct question monetari condit domest demand grow strongli said note interest rate histor low level fund ampl schlesing said saw sign central bank money stock growth slow recent yearonyear pace eight pct well bundesbank three six pct target said target could still achiev much depend direct longterm capit flow heavi inflow particularli januari around time em revalu boost domest money suppli still certain hope net inflow foreign money diminish even littl bit revers schlesing said major reason inflow market convict mark head higher see market expect revalu deutschemark diminish schlesing said recent widen interest rate differenti fact dollar fallen sharpli short period improv real trade balanc combin toward stabil dollar said ask central bank might act prevent sharp dollar rise u march dollar rose mark said would depend circumst midday dollar stood mark central bank alway contact fluctuat cannot give answer would react schelsing said one look market move said ad case also american case said west german export industri hit hard dollar sharp fall would probabl like see correct wouldnt good shortterm fluctuat said let u wait see mainli strength dollar fall short period littl bit shock level rate schlesing said sharp rise mark coupl weak price key commod oil favour impact west german inflat year although recent sign inflat pick said due chang key commod price underli inflat rate year would unchang one pct said schlesing said problem rapid money suppli growth longer term economi build potenti possibl eventu resurg inflat abovetarget growth money suppli past month prompt discuss use target matter might taken midyear meet bundesbank council schlesign said ad dont see great pressur go away
151,al laboratori inc th qtr net shr ct v ct net v rev mln v mln mth shr ct v ct net v rev mln v mln note net qtr yr adjust reflect retroact effect threefortwo stock split distribut sharehold juli august net includ result oper parm pharmaceut inc acquir may
152,concern el nino peru usda report heighten fear el nino may return peru intens approach disast affect weather sever contin caus widespread damag flood drought u agricultur depart offic lima said field report continu heavi rain northern coastal area flood sever major river mud slide led increas concern report date march said howev said offici sourc still believ year el nino weak moder intens el nino phenomenon involv shift wind water pacif usda report said far el nino experienc overal neg impact agricultur product excess rain piura pima cotton area may reduc yield pct due excess growth earli crop cycl also insect damag crop could extens excess moistur exist said howev el nino result much improv suppli irrig water major dam improv prospect mani crucial crop rice corn slow declin sugar product said el nino pick momentum peru fish industri could receiv setback trade sourc still believ fish catch industri process reach mln tonn almost pct last year report said water temperatur northern fish area three four degre centigrad normal still high enough drive fish cooler southern water said said still outsid chanc el nino intensifi carri late march april may caus problem crop approach harvest appear way project cours el nino time tell report said
153,gatt set disput panel canadian her rule gatt council set formal disput panel examin u complaint canadian law prohibit export unprocess her salmon discriminatori david wood offici spokesman gener agreement tariff trade gatt told news brief decis taken bilater consult fail resolv row u ambassador michael samuel charg council debat canada tri preserv domest job insist her salmon process home robert white canada deputi chief deleg repli law line gatt rule conserv reason agre set disput panel
154,central bank system inc qtli dividend qtli div ten ct v ten ct pay april record april
155,armtek sell tire truck tire busi armtek corp formerli known armstrong rubber co said sign agreement corp sale natchez miss tire plant truck tire sale servic corp term disclos armtek spokesman john siever said mln dlr busi earlier week armtek announc sale industri tire assembl busi divis dyneer corp scotsdal ariz cash proce sale use reduc outstand debt long term suppli agreement conder anticip truck tire produc natchez plant suppli armstrong tire co armtek oper compani compani said close schedul conclud march said
156,german financ ministri confid maintain currenc stabil around current level spokesman german financ ministri confid maintain currenc stabil around current level spokesman
157,bull bear group inc year end dec shr loss ct v profit ct net loss v profit rev v
158,manag group restaur major restaur associ industri inc said manag group led chairman martin brodi presid max pine octob receiv class class b share respons tender offer share dlr give thema major class share compani said tender extend novemb
159,opec want dlr oil price oapec offici opec belief world oil price set around fix averag price dlr barrel oapec assist gener secretari abdelaziz alwattari said speech european communityoapecopec seminar luxembourg releas alwattari said opec belief world energi trade kept without restrict built around fix averag price dlr alwattari note total opec output organ agre ceil member countri februari although meant sacrific effect sacrific meant market stabil though restor good level still pressur alwattari said last stabil world market requir wider scope intern cooper said
160,toy r u inc th qtr feb one net shr ct v ct net mln v mln rev billion v mln mth shr dlr v ct net mln v mln rev billion v billion note net restat reflect threefortwo stock split june
161,japan expect cut base rate state bodi japan expect cut base lend rate state financi institut pct part recent pact major industri nation pari financ ministri sourc said said cut base revis trust fund bureau law approv parliament march abolish pct minimum interest rate deposit bureau bureau channel fund govern financi institut public work offici us said base lend rate state bodi japan develop bank peopl financ corp financ corpor local public enterpris usual move tandem longterm prime rate sourc said howev imposs follow last cut pct pct januari trust fund bureau rate legal set pct ministri abolish minimum rate introduc marketrel one resolv problem stimul domest economi said tuesday ministri allow longterm banker cut prime record low pct effect februari move suggest reach agreement depositor use bureau postal save system post telecommun ministri japan welfar annuiti ministri health welfar sourc said ministri tri determin market rate consid set bureau deposit rate ministri sourc said coupon rate new year govern bond minu percentag point likeliest choic ad
162,bp oil rais oper profit oil ltd uk market refin arm british petroleum co plc rais pretax oper profit replac cost basi mln stg calendar compar mln stg sale oper revenu fell billion stg billion replac cost basi histor cost oper profit mln stg mln bp oil said profit depress except item profit figur state interest charg chief execut david kendal said improv result mirror benefit restructur program undertaken recent year howev warn futur financi pressur industri sever uk oil market refin industri need invest larger sum probabl around mln stg year good mani year said statement
163,ec commiss reject sugar threat sourc european commun commiss told ec member state prepar discu ec sugar price sugar trader threaten make huge sale intervent stock protest polici commiss sourc said posit will discu problem market price time trader make threat one sourc said sourc said commiss view made clear meet sugar manag committe today said french west german dutch offici inform committe trader countri intend sell tonn sugar ec intervent stock commiss ripost signal would sell sugar sold intervent back onto ec market tender move would push price sourc said french trader plan sell tonn intervent stock west german trader tonn dutch trader
164,volvo group compani propos twoforf issu catena ab volvo pct stake said propos twoforf stock issu rais compani equiti capit mln crown mln catena report profit financi incom cost mln crown mln despit increas sale billion crown billion compani said perform best reflect earn writeoff rose mln mln catena increas sale mainli due takeov safvean ab februari chang busi profil catena princip oper volvo dealer safvean acquisit mainli trade industri compani decemb catena sold share stockbrok firm jacobson och ponsbach fondkommiss ab yield profit mln crown reflect catena pretax earn rose mln crown mln
165,uniforc temporari set split uniforc temporari personnel inc said declar threefortwo stock split payabl may stockhold record april
166,bindley western industri inc qtr net oper shr primari ct v ct oper shr dilut ct v ct oper net v rev mln v mln avg shr primari v avg shr dilut mln v mln year oper shr primari ct v ct oper shr dilut ct v ct oper net v rev mln v mln avg shr primari v avg shr dilut mln v note rev includ invest incom dlr v dlr qtr mln dlr v dlr mth rev also includ unreal loss equiti secur dlr qtr dlr mth oper net exclud extraordinari gain dlr v dlr qtr dlr v dlr mth
167,pansoph system split stock pansoph system inc said split stock twoforon effect april two sharehold record march also said pay six ct per share dividend presplit share regular quarterli dividend april two sharehold record march
168,lindner tell sec talk taft seek control compani lindner tell sec talk taft seek control compani
169,broker secur inc th qtr loss shr loss ct v profit ct net loss v profit rev v avg shr v year shr profit seven ct v profit ct net profit v profit rev v avg shr v note yearago net includ extraordinari gain qtr year
170,acm electr corp st qtr oct two shr ct v four ct qtli div eight ct v eight ct net v rev mln v mln note st qtr adjust five pct stock dividend pain march qtli dividend payabl decemb seven sharehold record novemb nine
