,0
229,harcourt brace call special meet harcourt brace jovanovich inc said call special meet juli vote increas author common share mln mln increas prefer share mln provis allow payment prefer dividend stock properti well cash compani said june record date meet harcourt fight takeov bid print commun corp plc declar special dividend common stock dlr cash pct prefer stock market valu dlr per share special dividend paid juli
230,japan still ask institut limit specul dlrdeal miyazawa japan still ask institut limit specul dlr deal miyazawa
231,finnish wholesal price rise pct februari finnish wholesal price rose pct februari rise one pct januari drop pct februari central statist offic said yearonyear wholesal price fell pct februari drop pct januari pct februari wholesal price index base februari januari februari last year
232,metex corp th qtr dec shr ct v ct net v rev mln v mln year shr ct v dlr net mln v mln rev mln v mln
233,aluminium capac growth trend seen insuffici aluminium capac expans plan period insuffici suppli acceler demand growth let alon increas scale seem like accord analyst anthoni bird associ aluminium review nonsocialist world primari capac need around mln tonn wherea current plan mln tonn schedul bird said bird forecast higher econom growth increas import le develop countri aluminium consumpt growth expect acceler much gener growth nonsocialist world consumpt nevertheless forecast increas sharpli mln tonn mln tonn bird said aluminium compani slow adjust pace chang review said complet transit may danger remain preoccupi strategi retrench surviv serv well recent year order encourag construct addit smelter aluminium price need settl higher level product cost like rise year ahead glut alumina capac vanish electr supplier take aggress line aluminium compani accord review march price three like costpric scenario call longrun aluminium price cent lb depend exchang rate bird said price develop expect caus mark competit problem metal like rise commod price whole cost pressur pipelin steel copper short term howev outlook dull bird said world economi respond well opportun offer cheap oil consumpt forecast mln tonn pct product forecast six pct higher mln tonn
234,bank japan call longterm effort trade shortterm effect foreign exchang rate movement correct intern trade imbal appear wane longterm effort requir cut japan chronic depend extern demand bank japan said monthli report japan trade surplu nomin term like remain high near futur central bank said fundament adjust need long japan hope benefit better intern alloc resourc maintain free trade system ad
235,pacif ga said account chang reduc net mln dlr pacif ga said account chang reduc net mln dlr
236,american medic intern inc payout qtli div ct v ct prior qtr payabl may one record april
237,u corpor financ new zealand dlr frn floatingr note denomin foreign currenc rel new wrinkl wall street probabl issu infrequ socal window opportun open close quickli trader say two day mani issu result market becam glut said one trader said window depend suppli foreign exchang interest rate risk least moment obvious currenc risk import limit number investor right paper said thursday bear stearn co solemanag mln new zealand dlr offer threeyear floatingr note issu ford motor credit co unit ford motor co initi rate note set april quarterli basi point day new zealand bank bill rate noncal life follow week anoth bear stearnsl offer amount new zealand dollar note dow chemic co initi rate also initi set april quarterli basi point day new zealand rate dow chemic note carri interest rate floor pct issu saw strong investor demand underwrit said ford credit note friday offer mln new zealand dlr floatingr note due issu gener electr co gener electr credit corp via prudentialbach secur inc floor obvious two firm want issu floater face risk new zealand rate fall sharpli underwrit away syndic said other note new zealand day rate pct late last week underwrit familiar dow chemic deal point interest rate currenc swap dow issuer felt comfort set rate floor domest offer foreign currenc denomin date first surfac fall use currenc rate swap compani sell debt pay high interest rate foreign currenc like australian new zealand dollar issuer actual realiz save borrow cost would say everi compani issu foreign currenc debt save basi point compar samematur plain vanilla u issu analyst said investor mainli institut attract earli issu high interest rate will absorb foreign currenc risk mid sharp slide post australian new zealand dollar brought issuanc quick halt late last year currenc stabil compani start issu debt denomin australian new zealand dollar mani investor still shi away debt rememb mid downturn australian new zealand dollar analyst note attract investor back fold underwrit like bear stearn decid structur foreign currenc issu float rate debt sourc said occur backdrop uncertainti cours u interest rate intermedi term predict number economist treasuri yield would rise second half year sourc note bear stearn offic said half ford credit note sold late friday afternoon second day offer quicker recent fixedr new zealand dollar note issu said howev underwrit away bear stearn syndic said issu may sold even faster prudentialbach offer gener electr credit note friday point ford note rate moodi investor aaminu standard poor gener electr note interest rate term also noncal matur carri topflight aaa rate agenc sold pct ge note firstday sale friday afternoon im happi result offic prudentialbach syndic desk said investor pay u dollar equival foreign currencydenomin note underwrit said invest banker said next floatingr issu new zealand australian dollardenomin debt probabl week away would like underwrit deal day dow ford ge offer marketplac enough time prudentialbach offic admit meanwhil idd inform servic said day corpor visibl suppli fell billion dlr last week billion dlr previou week
238,top discount rate uk bill tender rise pct top discount rate uk bill tender rise pct
239,usda report corn switch ussr u agricultur depart said privat u export report tonn corn previous unknown destin switch soviet union corn deliveri market year fourth year usussr long term grain suppli agreement market year began septemb sale corn ussr deliveri fourth year agreement began octob total tonn said third agreement year sale total tonn tonn wheat tonn corn
240,first wisconsin make acquisit first wisconsin corp said agre acquir north shore bancorp inc northbrook ill dlr cash slightli twice book valu subject approv north shore sharehold regulatori author compani said complet expect third quarter
241,u grain carload fall week u grain carload total car week end march pct previou week pct correspond week year ago associ american railroad report grain mill product load week total car pct previou week pct week year earlier associ said
242,mhi group affili cemetari offer mhi group inc said affili sever investor enter letter intent provid purchas star david memori garden cemeteri compani said investor certain circumst cede right letter intent definit agreement purchas fort lauderdal fla funer home cemeteri busi mhi
243,huntington bancshar inc rd qtr net shr ct v ct shr dilut ct v ct net mln v mln avg shr mln v mln nine mth shr dlr v dlr shr dilut dlr v dlr net mln v mln avg shr mln v mln note share adjust juli pct stock dividend result restat pool acquisit net includ loan loss provis dlr v dlr quarter mln dlr v mln dlr nin mth
244,empir carolina inc th qtr net shr ct v ct net dlr v dlr rev mln dlr v mln dlr mth shr dlr v ct net dlr v dlr rev mln dlr v mln dlr note empir invest deltona corp report equiti method begin fourth qtr amount first three qtr restat reflect retroact applic pct debentur dlr prefer stock redeem convert result common share outstand decemb compar common share outstand decemb
245,uk money market deficit forecast mln stg bank england said forecast shortag around mln stg money market today among main factor affect liquid bill matur offici hand takeup treasuri bill drain billion stg partli offset outflow fall note circul add mln stg exchequ transact around mln banker balanc target mln
246,southern california edison co qtli div qtli div ct v ct pay april record april
247,wallenberg fight bid swedish match stake sweden wallenberg group fought back bid londonbas swedish financi erik penser secur larg stake swedish match st one compani core busi empir statement issu wallenberg hold compani ab investor forvaltn ab providentia said taken option held nobel industri sweden ab acquir pct vote right swedish match thre wallenberg paid nobel industri st penser group pct stake pct market price swedish match option statement said swedish match b share open foreign buyer close crown friday share increas vote right close crown restrict free share statement said deal increas investor stake pct vote right pct share capit providentia left hold pct vote right pct share capit swedish match wallenberg stake swedish match previous amount pct vote right compani swedish match deal cost wallenberg mln crown share analyst said make one expensis move group undertaken last four year defend farflung interest outsid predat wallenberg origin sold nobel industri arm chemic group penser pay buy volvo st two key group compani atla copco st stora koppaberg st sinc wallenberg oust largest sharehold skf skfr st skanska ab st frederik lundberg wrest control incent ab lundberg zurichbas swedish properti tycoon also manag acquir pct stake anoth wallenberg compani diari equip firm alfa laval ab st wallenberg concentr build stake investor providentia prevent raid heart busi empir analyst say wallenberg posit electr engin firm asea ab st also small pct vote right grow specul group forc sell fring interest protect core activ
248,creditanstalt see higher dividend creditanstaltbankverein like rais dividend payment pct share capit deputi generaldirector guido schmidtchiari said dividend pct unchang previou year schmidtchiari note parent bank share capit risen billion schill end billion year earlier schmidtchiari made forecast news confer bank announc consolid bank group net profit mln schill mln schmidtchiari elabor dividend forecast bank group consolid balanc sheet total rose billion schill yearend billion gener director hann androsch said higher invest would lead continu growth profit futur last year better profit result improv servic provid bank also profit schill lend schill lend grown last year interest rate margin also improv remain unsatisfactori compar countri said increas provis possibl bad debt home abroad particularli latin america lower profit androsch said declin give exact figur schmidtchiari said foreign lend busi fallen significantli due exchang rate fluctuat remov billion schill balanc sheet total attempt gener foreign busi repres offic would open year tokyo hong kong moscow pragu androsch welcom govern plan abolish legal control foreign buy vote share draw dividend prefer share statecontrol creditanstalt rose eight schill vienna bours today broker said improv result wide expect investor androsch said industri hold perform better previou year give return invest pct compar pct creditanstalt austria largest bank hold major interest mediums larg austrian compani forecast biggest industri subsidiari steyr daimlerpuch ag would return result similar expect oper loss mln schill
249,hadson acquir pct seax hadson corp said sign definit agreement acquir pct outstand common stock seax energi corp compani said buy pct interest seax sharehold own restrict control share le hadson common share said close subject approv titl assign french govern seax involv oil natur ga explor develop pari basin franc
250,pep boy manni moe jack inc st qtr may two net shr ct v eight ct net v sale mln v mln note share adjust threeforon stock split payabl juli holder record juli one
251,nippon life seek tie u secur hous life insur co purs possibl link american secur hous expand oversea invest portfolio compani spokesman said declin comment rumour compani would take pct stake lehman brother invest bank unit american express co said firm start sound sever u invest bank capit particip month ago narrow number prospect say set sight one firm nippon life japan largest life insur also plan set wholli own invest unit intern america new york next month subsidiari canada singapor cayman island jersey year said move line longterm strategi put emphasi oversea invest manag opportun home declin compani asset grow compani especi attract scale depth u money credit market want establish firm foothold spokesman ad
252,overseachines bank corp ltd year shr ct v ct fin div ct gross v ct group net mln dlr v mln note fin div pay june record may
253,eaton vanc corp st qtr jan net shr ct v ct net v avg shr v
254,virateck inc st qtr feb oper loss oper shr loss ct v profit ct oper loss v profit rev v note oper data includ year ago extraordinari gain dlr nine ct per shr
255,pse inc th qtr shr loss ct v profit ct net loss mln v profit rev mln v mln year shr loss ct v profit five ct net loss mln v profit rev mln v mln
256,colombia trader say new coffe strategi vital coffe produc countri must quickli map fresh common strategi follow failur intern coffe organ ico reach agreement export quota gilberto arango presid colombia privat coffe export associ said arango told reuter intellig thing would seek unifi stand produc includ brazil order map strategi defend price ico special meet end last night london export consum nation fail agre resumpt export quota suspend one year ago price soar follow prolong drought brazil arango said would immin catastroph predict short term price would undoubtedli plummet howev said market also take account evid factor brazil low stock sale near total central american crop trade sourc said colombia coffe today quot dlr lb new york second lowest price past year cardena said countri appar fail understand true impact failur coffe produc nation well industri countri difficult believ effort made solv problem develop world extern debt decis taken cut earn use repay debt said colombia case watch constern tri effect combat drug traffick countri support u fight seek cut jugular vein cardena said
257,u mint seek offer copper nickel u mint said seek offer lb electrolyt copper lb electrolyt cut nickel cathod briquett intend purchas said metal deliveri week may olin corp east alton ill offer copper due hr edt april offer nickel due hr edt april mint said firm submit offer select receiv payment standard check wire transfer award determin whichev two method cost advantag base cost money time minimum accept period solicit three calendar day copper calendar day nickel mint said
258,dutch consumersindustri see veg oil tax threat dutch consum food processor would hit hard propos ec tax oil fat dick de bruyn chairman commod board margarin fat oil mvo said annual meet dutch second largest consum margarin fourth largest consum veget oil ec fierc contest tax would levi consum steepli increas cost industri potato process cake biscuit manufactur de bruyn said move industri countri outsid ec cannot rule ad de bruyn said tax veget marin oil fat would wide open fraud difficult polic huge expens administr also said propos tax contraven articl three gener agreement tariff trade gatt lome convent unit nation food agricultur organ fao guidelin also ec treati propos tax would inflationari also consequ employ invest ad
259,fidata corp th qtr loss shr loss two ct v profit ct net loss v profit rev v mln year shr profit dlr v profit ct net profit mln v profit rev mln v mln note net includ pretax secur sale gain dlr v loss dlr quarter gain dlr v loss dlr year net includ pretax gain sale busi nil v dlr quarter mln dlr v dlr year net includ pretax loss disposit product line nil v dlr quarter dlr v dlr year quarter net includ tax credit dlr v dlr net includ revers tax loss carryforward dlr v dlr quarter tax loss carryforward dlr v dlr year
260,bond corp still consid atla mine bailout bond corp hold ltd atla consolid mine develop corp still hold talk bailout packag troubl mine firm atla statement said atla philippin biggest copper produc said hit depress world copper price report net loss mln peso year end decemb compar net loss billion compani said abl cut loss scaleddown copper oper central island cebu start second half atla said negoti continu acquisit bond compani exist bank loan restructur gold loan memorandum understand sign two side octob last year said bond would acquir atla total loan mln dlr repaid mine compani gold atla said two side also discuss equiti infus atla creation develop fund explor develop compani gold properti central provinc masbat wilson bank gener manag corp intern ltd hong kong told reuter atla statement negoti reason accur bank said bond corp serious consid sever invest philippin give detail statement atla said develop preworld war two underground mine masbat acceler ore tonnag increas extend oper life least
261,tajon ranch co th qtr net shr five ct v nine ct net v rev v year shr ten ct v ct net v rev mln v mln
262,willcox gibb inc th qtr net oper shr ct v ct oper net v sale mln v mln avg shr v year oper shr dlr v dlr oper net v sale mln v mln avg shr v note oper net exclud gain dlr ct share quarter dlr dlr share year tax carryforward
263,baker deni dollar target exist u treasuri secretari jame baker said meet six major industri nation pari last month establish target exchang rate dollar baker said televis interview air yesterday dont target dollar declin comment might desir level dollar say realli dont talk dollar said protection becom extrem strong u respons widen u trade deficit import barrier countri mood unit state extrem disturb extrem strong said ive said sort see engag real struggl preserv world free trade system largest market world u go protectionist run risk move path world late said rel exchang rate role play defus threat protection alon offer solut said must address problem exchang rate side cannot solv exchang rate side alon far comprehens broad solut requir comprehens approach baker said interview baker said would necessari countri adjust currenc upward well remov barrier u import elabor name countri
264,bundesbank retain money suppli polici bundesbank council member lothar mueller said bank given money suppli polici restrain money suppli growth alway mean push interest rate mueller said articl boersen zeitung financi daili monetari polici took account exchang rate expect capit flow could confus exchang rate orient polici articl follow intern press specul bundesbank abandon money suppli target favour exchang rate polici mueller member bundesbank council posit presid region state central bank bavaria note bundesbank decis januari cut lead interest rate amid continu strong monetari growth led peopl think drop monetari target simpli ignor extern econom context would riski danger monetari polici explain mueller said cut offici interest rate put end interest rate specul bundesbank could assum upward pressur mark would eas currenc inflow slow lower money market rate achiev widen short long term interest rate differenti also encourag investor reinvest fund park liquid account mueller said measur therefor aim clearli bring monetari growth back onto desir path said final cours need keep quiet cut interest rate also line chang econom situat last month ad bundesbank way abandon money suppli polici januari discount rate cut despit supposit contrari mueller said keep money suppli develop check alway synonym rais interest rate especi excess liquid due inflow abroad rather growth bank credit caus rise monetari hold nonbank mueller said west germani longer ran larg extern deficit concept need monetari polici mueller said would difficult danger monetari polici pursu specif markdollar exchang rate case exchang rate partli depend u currenc budgetari polici u economi said exchang rate orient would also mean end strict stabil polici interest rate liquid would affect requir currenc intervent could longer steer autonom bundesbank even interest rate centr bundesbank consider reflect competit market condit mueller said cut bank liquid directli influenc central bank money stock bundesbank main money suppli indic reflect bank liquid liquid industri household cannot directli reach bundesbank instrument mueller said le depend nonbank bank credit harder steer money suppli increasingli case recent nonbank receiv consider sum current account surplu capit import bundesbank tri brake money suppli rise higher interest rate would appropri credit grow excess would miss target probabl even set inflow said mueller said growth money suppli still high last three month money stock grew annual rate seven pct pct previou quarter growth curv therefor come closer three six pct target corridor central bank money stock growth point success current polici said high monetari stock warn sign chang prioriti monetari polici must first foremost stabil polici success stabil polici money suppli polici noth els said
265,hartford steam set split dividend hike hartford steam boiler inspect insur co said board declar twoforon stock split rais quarterli dividend ct postsplit ct payabl april holder record april
266,ec mainli tin extens uk stand taken european commun ec member intern tin council except britain said prepar back extens intern tin agreement ec spokesman said said meet ec state repres yesterday britain undertook commun decis partner today said readi yesterday take stand say ad nine ec state back extens spain portug member intern tin council rais object common ec stanc favour
267,suburban bancorp woodstock bancorp merg suburban bancorp inc woodstock state bancorp inc said agre merger suburban purchas woodstock share total mln dlr cash suburban bancorp share woodstock hold compani mln dlr state bank woodstock merger bring suburban asset mln dlr total bank merger subject regulatori sharehold approv
268,higher spend expect malaysia budget malaysia recoveri worst recess year receiv boost friday govern announc reflationari budget calendar seven year auster economist said countri walk one leg said ismail salleh economist institut strateg intern studi depend public sector invest faster growth privat sector move gross domest product grew one pct shrink one pct fiscal year end decemb govern said expect growth two pct analyst believ nearer three pct price commod export risen sharpli malaysia lead export rubber palm oil tin semiconductor major produc cocoa timber oil govern slash develop spend billion ringgit year billion economist said unemploy expect exceed pct pct year local invest also stagnat businessmen blame inconsist econom polici lack incent one businessman said mani politician give impress malaysia unstabl take care invest confid potenti recov strongli great banker said malaysia current account expect black central bank project mln ringgit surplu compar last year billion ringgit deficit govern said fiscal polici balanc budget deficit mln ringgit govern also repay extern debt stood billion ringgit end polit leader said budget hurt ordinari peopl tax basic food essenti good unlik chang businessmen said hope govern also cut corpor tax pct enabl malaysia compet investor neighbour state
269,colgatepalmol co set quarterli qtli div ct v ct prior pay may record april
270,campbel red lake mine ltd th qtr shr ct v ct campbel red lake mine ltd th qtr shr ct v ct
271,u militari leader predict iranian respons william crow chairman u joint chief staff predict iran retali u strike oil platform though said iranian option limit determin easili deter let stress commit go risk free casualti free said like iranian respons would involv terror lay mine obvious look way probabl line silent hand tri thu far crow told american stock exchang confer declin comment report queri whether favor stronger move iran order presid carri oper decid upon carri enthusiasm think profession well done crow said
272,washington feder save quarterli div qtli div ct v ct pay april record april note year ago adjust reflect march threefortwo stock split washington feder save loan associ
273,bankeast corp st qtr net shr ct v ct net v asset billion v mln deposit mlnv mln loan mln v mln note result restat reflect acquisit unit bank corp
274,usair get approv buy piedmont share tender usair get approv buy piedmont share tender
275,dupont unit rais crude oil post conoco inc subsidiari dupont denemour said rais contract price pay grade crude oil ct barrel effect yesterday increas bring conoco post price west texa intermedi dlr barrel west texa sour grade api stand dlr barrel light louisiana also rais ct dlr barrel conoco last chang crude post may
276,comex rais margin gold copper futur effect today open offici comex rais margin gold copper futur effect today open offici
277,amoskeag bank seek rehear amoskeag bank share inc save bank said file motion rehear new hampshir suprem court march rule overturn state regulatori approv amoskeag acquisit portsmouth ramif decis believ go well beyond affili amoskeag portsmouth save bank said amoskeag chairman william bushnel transact oppos group portsmouth investor want bank remain independ accord press report
278,fed say set two billion dlr custom repurchaseagr fed say set two billion dlr custom repurchas agreement
